[
  {
    "id": "a1-001",
    "name": "Bulbasaur",
    "set_code": "a1",
    "pack": "Mewtwo",
    "type": "Pokémon",
    "subtype": "Grass",
    "stage": "Basic",
    "rarity": "◊",
    "ex": false,
    "mega": false,
    "health": 70,
    "points": 1,
    "deckBuilderNr": 1,
    "image": "https://raw.githubusercontent.com/chase-manning/pokemon-tcg-pocket-cards/refs/heads/main/images/webp/cards/a1/001.webp"
  },
  {
    "id": "a1-002",
    "name": "Ivysaur",
    "set_code": "a1",
    "pack": "Mewtwo",
    "type": "Pokémon",
    "subtype": "Grass",
    "stage": "Stage 1",
    "rarity": "◊◊",
    "ex": false,
    "mega": false,
    "health": 90,
    "points": 1,
    "deckBuilderNr": 2,
    "image": "https://raw.githubusercontent.com/chase-manning/pokemon-tcg-pocket-cards/refs/heads/main/images/webp/cards/a1/002.webp"
  },
  {
    "id": "a1-003",
    "name": "Venusaur",
    "set_code": "a1",
    "pack": "Mewtwo",
    "type": "Pokémon",
    "subtype": "Grass",
    "stage": "Stage 2",
    "rarity": "◊◊◊",
    "ex": false,
    "mega": false,
    "health": 160,
    "points": 1,
    "deckBuilderNr": 3,
    "image": "https://raw.githubusercontent.com/chase-manning/pokemon-tcg-pocket-cards/refs/heads/main/images/webp/cards/a1/003.webp"
  },
  {
    "id": "a1-004",
    "name": "Venusaur ex",
    "set_code": "a1",
    "pack": "Mewtwo",
    "type": "Pokémon",
    "subtype": "Grass",
    "stage": "Stage 2",
    "rarity": "◊◊◊◊",
    "ex": true,
    "mega": false,
    "health": 190,
    "points": 2,
    "deckBuilderNr": 4,
    "image": "https://raw.githubusercontent.com/chase-manning/pokemon-tcg-pocket-cards/refs/heads/main/images/webp/cards/a1/004.webp"
  },
  {
    "id": "a1-005",
    "name": "Caterpie",
    "set_code": "a1",
    "pack": "Pikachu",
    "type": "Pokémon",
    "subtype": "Grass",
    "stage": "Basic",
    "rarity": "◊",
    "ex": false,
    "mega": false,
    "health": 50,
    "points": 1,
    "deckBuilderNr": 5,
    "image": "https://raw.githubusercontent.com/chase-manning/pokemon-tcg-pocket-cards/refs/heads/main/images/webp/cards/a1/005.webp"
  },
  {
    "id": "a1-006",
    "name": "Metapod",
    "set_code": "a1",
    "pack": "Pikachu",
    "type": "Pokémon",
    "subtype": "Grass",
    "stage": "Stage 1",
    "rarity": "◊",
    "ex": false,
    "mega": false,
    "health": 80,
    "points": 1,
    "deckBuilderNr": 6,
    "image": "https://raw.githubusercontent.com/chase-manning/pokemon-tcg-pocket-cards/refs/heads/main/images/webp/cards/a1/006.webp"
  },
  {
    "id": "a1-007",
    "name": "Butterfree",
    "set_code": "a1",
    "pack": "Pikachu",
    "type": "Pokémon",
    "subtype": "Grass",
    "stage": "Stage 2",
    "rarity": "◊◊◊",
    "ex": false,
    "mega": false,
    "health": 120,
    "points": 1,
    "deckBuilderNr": 7,
    "image": "https://raw.githubusercontent.com/chase-manning/pokemon-tcg-pocket-cards/refs/heads/main/images/webp/cards/a1/007.webp"
  },
  {
    "id": "a1-008",
    "name": "Weedle",
    "set_code": "a1",
    "pack": "Mewtwo",
    "type": "Pokémon",
    "subtype": "Grass",
    "stage": "Basic",
    "rarity": "◊",
    "ex": false,
    "mega": false,
    "health": 50,
    "points": 1,
    "deckBuilderNr": 8,
    "image": "https://raw.githubusercontent.com/chase-manning/pokemon-tcg-pocket-cards/refs/heads/main/images/webp/cards/a1/008.webp"
  },
  {
    "id": "a1-009",
    "name": "Kakuna",
    "set_code": "a1",
    "pack": "Mewtwo",
    "type": "Pokémon",
    "subtype": "Grass",
    "stage": "Stage 1",
    "rarity": "◊",
    "ex": false,
    "mega": false,
    "health": 80,
    "points": 1,
    "deckBuilderNr": 9,
    "image": "https://raw.githubusercontent.com/chase-manning/pokemon-tcg-pocket-cards/refs/heads/main/images/webp/cards/a1/009.webp"
  },
  {
    "id": "a1-010",
    "name": "Beedrill",
    "set_code": "a1",
    "pack": "Mewtwo",
    "type": "Pokémon",
    "subtype": "Grass",
    "stage": "Stage 2",
    "rarity": "◊◊◊",
    "ex": false,
    "mega": false,
    "health": 120,
    "points": 1,
    "deckBuilderNr": 10,
    "image": "https://raw.githubusercontent.com/chase-manning/pokemon-tcg-pocket-cards/refs/heads/main/images/webp/cards/a1/010.webp"
  },
  {
    "id": "a1-011",
    "name": "Oddish",
    "set_code": "a1",
    "pack": "Charizard",
    "type": "Pokémon",
    "subtype": "Grass",
    "stage": "Basic",
    "rarity": "◊",
    "ex": false,
    "mega": false,
    "health": 60,
    "points": 1,
    "deckBuilderNr": 11,
    "image": "https://raw.githubusercontent.com/chase-manning/pokemon-tcg-pocket-cards/refs/heads/main/images/webp/cards/a1/011.webp"
  },
  {
    "id": "a1-012",
    "name": "Gloom",
    "set_code": "a1",
    "pack": "Charizard",
    "type": "Pokémon",
    "subtype": "Grass",
    "stage": "Stage 1",
    "rarity": "◊◊",
    "ex": false,
    "mega": false,
    "health": 80,
    "points": 1,
    "deckBuilderNr": 12,
    "image": "https://raw.githubusercontent.com/chase-manning/pokemon-tcg-pocket-cards/refs/heads/main/images/webp/cards/a1/012.webp"
  },
  {
    "id": "a1-013",
    "name": "Vileplume",
    "set_code": "a1",
    "pack": "Charizard",
    "type": "Pokémon",
    "subtype": "Grass",
    "stage": "Stage 2",
    "rarity": "◊◊◊",
    "ex": false,
    "mega": false,
    "health": 140,
    "points": 1,
    "deckBuilderNr": 13,
    "image": "https://raw.githubusercontent.com/chase-manning/pokemon-tcg-pocket-cards/refs/heads/main/images/webp/cards/a1/013.webp"
  },
  {
    "id": "a1-014",
    "name": "Paras",
    "set_code": "a1",
    "pack": "Pikachu",
    "type": "Pokémon",
    "subtype": "Grass",
    "stage": "Basic",
    "rarity": "◊",
    "ex": false,
    "mega": false,
    "health": 70,
    "points": 1,
    "deckBuilderNr": 14,
    "image": "https://raw.githubusercontent.com/chase-manning/pokemon-tcg-pocket-cards/refs/heads/main/images/webp/cards/a1/014.webp"
  },
  {
    "id": "a1-015",
    "name": "Parasect",
    "set_code": "a1",
    "pack": "Pikachu",
    "type": "Pokémon",
    "subtype": "Grass",
    "stage": "Stage 1",
    "rarity": "◊◊",
    "ex": false,
    "mega": false,
    "health": 120,
    "points": 1,
    "deckBuilderNr": 15,
    "image": "https://raw.githubusercontent.com/chase-manning/pokemon-tcg-pocket-cards/refs/heads/main/images/webp/cards/a1/015.webp"
  },
  {
    "id": "a1-016",
    "name": "Venonat",
    "set_code": "a1",
    "pack": "Mewtwo",
    "type": "Pokémon",
    "subtype": "Grass",
    "stage": "Basic",
    "rarity": "◊",
    "ex": false,
    "mega": false,
    "health": 60,
    "points": 1,
    "deckBuilderNr": 16,
    "image": "https://raw.githubusercontent.com/chase-manning/pokemon-tcg-pocket-cards/refs/heads/main/images/webp/cards/a1/016.webp"
  },
  {
    "id": "a1-017",
    "name": "Venomoth",
    "set_code": "a1",
    "pack": "Mewtwo",
    "type": "Pokémon",
    "subtype": "Grass",
    "stage": "Stage 1",
    "rarity": "◊◊",
    "ex": false,
    "mega": false,
    "health": 80,
    "points": 1,
    "deckBuilderNr": 17,
    "image": "https://raw.githubusercontent.com/chase-manning/pokemon-tcg-pocket-cards/refs/heads/main/images/webp/cards/a1/017.webp"
  },
  {
    "id": "a1-018",
    "name": "Bellsprout",
    "set_code": "a1",
    "pack": "Charizard",
    "type": "Pokémon",
    "subtype": "Grass",
    "stage": "Basic",
    "rarity": "◊",
    "ex": false,
    "mega": false,
    "health": 60,
    "points": 1,
    "deckBuilderNr": 18,
    "image": "https://raw.githubusercontent.com/chase-manning/pokemon-tcg-pocket-cards/refs/heads/main/images/webp/cards/a1/018.webp"
  },
  {
    "id": "a1-019",
    "name": "Weepinbell",
    "set_code": "a1",
    "pack": "Charizard",
    "type": "Pokémon",
    "subtype": "Grass",
    "stage": "Stage 1",
    "rarity": "◊◊",
    "ex": false,
    "mega": false,
    "health": 90,
    "points": 1,
    "deckBuilderNr": 19,
    "image": "https://raw.githubusercontent.com/chase-manning/pokemon-tcg-pocket-cards/refs/heads/main/images/webp/cards/a1/019.webp"
  },
  {
    "id": "a1-020",
    "name": "Victreebel",
    "set_code": "a1",
    "pack": "Charizard",
    "type": "Pokémon",
    "subtype": "Grass",
    "stage": "Stage 2",
    "rarity": "◊◊◊",
    "ex": false,
    "mega": false,
    "health": 140,
    "points": 1,
    "deckBuilderNr": 20,
    "image": "https://raw.githubusercontent.com/chase-manning/pokemon-tcg-pocket-cards/refs/heads/main/images/webp/cards/a1/020.webp"
  },
  {
    "id": "a1-021",
    "name": "Exeggcute",
    "set_code": "a1",
    "pack": "Charizard",
    "type": "Pokémon",
    "subtype": "Grass",
    "stage": "Basic",
    "rarity": "◊",
    "ex": false,
    "mega": false,
    "health": 50,
    "points": 1,
    "deckBuilderNr": 21,
    "image": "https://raw.githubusercontent.com/chase-manning/pokemon-tcg-pocket-cards/refs/heads/main/images/webp/cards/a1/021.webp"
  },
  {
    "id": "a1-022",
    "name": "Exeggutor",
    "set_code": "a1",
    "pack": "Charizard",
    "type": "Pokémon",
    "subtype": "Grass",
    "stage": "Stage 1",
    "rarity": "◊◊◊",
    "ex": false,
    "mega": false,
    "health": 130,
    "points": 1,
    "deckBuilderNr": 22,
    "image": "https://raw.githubusercontent.com/chase-manning/pokemon-tcg-pocket-cards/refs/heads/main/images/webp/cards/a1/022.webp"
  },
  {
    "id": "a1-023",
    "name": "Exeggutor ex",
    "set_code": "a1",
    "pack": "Charizard",
    "type": "Pokémon",
    "subtype": "Grass",
    "stage": "Stage 1",
    "rarity": "◊◊◊◊",
    "ex": true,
    "mega": false,
    "health": 160,
    "points": 2,
    "deckBuilderNr": 23,
    "image": "https://raw.githubusercontent.com/chase-manning/pokemon-tcg-pocket-cards/refs/heads/main/images/webp/cards/a1/023.webp"
  },
  {
    "id": "a1-024",
    "name": "Tangela",
    "set_code": "a1",
    "pack": "Charizard",
    "type": "Pokémon",
    "subtype": "Grass",
    "stage": "Basic",
    "rarity": "◊",
    "ex": false,
    "mega": false,
    "health": 80,
    "points": 1,
    "deckBuilderNr": 24,